{
  "schemaVersion": 1,
  "id": "raindrop-walk",
  "sourceIdeaId": "idea-010",
  "order": 10,
  "title": "Raindrop walk",
  "shortTitle": "First tune",
  "chapter": "Little tunes",
  "kind": "sequence",
  "difficulty": 4,
  "story": "A raindrop walks down to G, hops back to B, and rests by A.",
  "childCue": "Play B, A, G, A, B, B, A.",
  "adultCue": "This is an original garden tune. Let the child hear it in small pieces before trying the whole path.",
  "successCue": "You played the whole raindrop walk!",
  "pattern": [{ "note": "B5", "beats": 1 }, { "note": "A5", "beats": 1 }, { "note": "G5", "beats": 2 }, { "note": "A5", "beats": 1 }, { "note": "B5", "beats": 1 }, { "note": "B5", "beats": 1 }, { "note": "A5", "beats": 2 }],
  "stableMs": 375,
  "toleranceCents": 85,
  "tips": ["Try three notes at a time first.", "A rest is part of music too."],
  "accent": "sky"
}
